Sheet: Sheet1
A1: 材料 | B1: 配合比 | C1: 説明
A2: ZSVAS ジュニアプロテイン ココア味 | B2: 5 | C2: カルシウム、ビタミン配合ホエイたんぱく
A3: Bottega Baci 有機穀物コーヒー ミックス | B3: 5 | C3: 有機穀物飲料
A4: 脱脂粉乳 | B4: 5
A5: イヌリン | B5: 5
A6: パルスィート | B6: 1

Sheet: Sheet2
A1: 1杯配合量(g) | B1: 20
A3: 材料 | B3: 配合比 | C3: エネルギー | D3: タンパク質 | E3: 食塩相当量 | F3: カルシウム | G3: ビタミンD ug | H3: ビタミンE mg | I3: ビタミンB1 mg | J3: ビタミンB2 mg | K3: ナイアシン | L3: ビタミンB6 mg | M3: ビタミンB12 ug | N3: 葉酸 ug | O3: ビタミンC mg | P3: 食物繊維
A4: ZSVAS ジュニアプロテイン ココア味 | B4: 6 | C4: 100 | D4: 12 | E4: 0.44 | F4: 840 | G4: 1.75 | H4: 2.6 | I4: 2 | J4: 1.6 | K4: 8.4 | L4: 0.34 | M4: 2 | N4: 1.34 | O4: 180
A5: Bottega Baci 有機穀物コーヒー ミックス | B5: 5 | C5: 362 | D5: 3.7 | E5: 0.164
A6: 脱脂粉乳 | B6: 5 | C6: 356 | D6: 2.1 | E6: 2.2 | F6: 1200 | P6: 91.8
A7: イヌリン | B7: 3 | C7: 202 | E7: 0
A8: パルスィート | B8: 1 | C8: 143 | D8: 2.1
A10: 1杯あたりの成分 | C10: of:=SUM([.C4:.C9])/(SUM([.$B$4:.$B$9])/[.$B$1])/100 -> 11.63 | D10: of:=SUM([.D4:.D9])/(SUM([.$B$4:.$B$9])/[.$B$1])/100 -> 0.199 | E10: of:=SUM([.E4:.E9])/(SUM([.$B$4:.$B$9])/[.$B$1])/100 -> 0.02804 | F10: of:=SUM([.F4:.F9])/(SUM([.$B$4:.$B$9])/[.$B$1])/100 -> 20.4 | G10: of:=SUM([.G4:.G9])/(SUM([.$B$4:.$B$9])/[.$B$1])/100 -> 0.0175 | H10: of:=SUM([.H4:.H9])/(SUM([.$B$4:.$B$9])/[.$B$1])/100 -> 0.026 | I10: of:=SUM([.I4:.I9])/(SUM([.$B$4:.$B$9])/[.$B$1])/100 -> 0.02 | J10: of:=SUM([.J4:.J9])/(SUM([.$B$4:.$B$9])/[.$B$1])/100 -> 0.016 | K10: of:=SUM([.K4:.K9])/(SUM([.$B$4:.$B$9])/[.$B$1])/100 -> 0.084 | L10: of:=SUM([.L4:.L9])/(SUM([.$B$4:.$B$9])/[.$B$1])/100 -> 0.0034 | M10: of:=SUM([.M4:.M9])/(SUM([.$B$4:.$B$9])/[.$B$1])/100 -> 0.02 | N10: of:=SUM([.N4:.N9])/(SUM([.$B$4:.$B$9])/[.$B$1])/100 -> 0.0134 | O10: of:=SUM([.O4:.O9])/(SUM([.$B$4:.$B$9])/[.$B$1])/100 -> 1.8 | P10: of:=SUM([.P4:.P9])/(SUM([.$B$4:.$B$9])/[.$B$1])/100 -> 0.918